"gene","weight","symbol","alias","annotation"
"LOC_Os06g45350",1,"--","None","protein kinase domain containing protein, expressed"
"LOC_Os10g10170",0.0110374984838,"--","None","PPR repeat domain containing protein, putative, expressed"
"LOC_Os01g21820",0.0105835925651,"--","None","preprotein translocase subunit secA, chloroplast precursor, putative, expressed"
"LOC_Os11g05556",0.0098569606312,"--","None","signal recognition particle 54 kDa protein, putative, expressed"
"LOC_Os06g13660",0.00970782704131,"--","None","alanyl-tRNA synthetase, putative, expressed"
"LOC_Os07g23990",0.00947187842268,"--","None","tetratricopeptide repeat domain containing protein, putative, expressed"
"LOC_Os04g58780",0.00943850084319,"WSL5|OsPPR4","None","pentatricopeptide repeat protein, putative, expressed"
"LOC_Os08g19140",0.00911122778385,"--","None","adenylate kinase family protein, putative, expressed"
"LOC_Os02g50560",0.00910344424241,"--","None","DSHCT domain containing protein, expressed"
"LOC_Os02g33500",0.00901497346132,"LAS","None","threonyl-tRNA synthetase, putative, expressed"
"LOC_Os11g38020",0.00888400043307,"--","None","GTPase of unknown function domain containing protein, putative, expressed"
"LOC_Os01g25600",0.00883012888069,"--","None","tetratricopeptide repeat domain containing protein, expressed"
"LOC_Os11g43600",0.00829554413967,"--","None","peptide chain release factor protein, putative, expressed"
"LOC_Os02g13970",0.00826423229495,"--","None","Complex I intermediate-associated protein 30 domain containing protein, putative, expressed"
"LOC_Os05g49970",0.00803640366347,"--","None","translation initiation factor IF-2, chloroplast precursor, putative, expressed"
"LOC_Os02g02390",0.00790157934603,"--","None","S1 RNA binding domain containing protein, expressed"
"LOC_Os02g37120",0.00782050218857,"--","None","expressed protein"
"LOC_Os02g06300",0.00769239884662,"--","None","GTP-binding protein lepA, putative, expressed"
"LOC_Os03g59640",0.00760302548585,"Chl1|OsChlD","None","magnesium-chelatase subunit chlD, chloroplast precursor, putative, expressed"
"LOC_Os11g37990",0.00744107555205,"--","None","chloroplastic group IIA intron splicing facilitator CRS1, chloroplast precursor, putative, expressed"
"LOC_Os01g11946",0.00727273782797,"--","None","ABC transporter, ATP-binding protein, putative, expressed"
"LOC_Os01g72800",0.00726066195314,"--","None","signal recognition particle receptor, putative, expressed"
"LOC_Os12g07110",0.0072286970247,"OsLACS9","None","acyl-CoA synthetase protein, putative, expressed"
"LOC_Os08g24390",0.00717791958806,"--","None","expressed protein"
"LOC_Os07g10540",0.00716266226451,"--","None","peptidase, M24 family protein, putative, expressed"
"LOC_Os06g20320",0.00711919976318,"OsTIG","None","peptidyl-prolyl cis-trans isomerase, FKBP-type, putative, expressed"
"LOC_Os07g18720",0.00707838504007,"--","None","tetratricopeptide repeat containing protein, putative, expressed"
"LOC_Os12g35630",0.00705896267011,"--","None","elongation factor TS family protein, expressed"
"LOC_Os12g34860",0.0070485682156,"--","None","phenylalanyl-tRNA synthetase, putative, expressed"
"LOC_Os02g36570",0.00697195824911,"OsABC1-2","None","ABC1 family domain containing protein, putative, expressed"
"LOC_Os01g69060",0.00678654871173,"--","None","hydrolase, alpha/beta fold family domain containing protein, expressed"
"LOC_Os07g28790",0.00661222030944,"--","None","PAP fibrillin family domain containing protein, expressed"
"LOC_Os04g56320",0.0066069254631,"--","None","AAA-type ATPase family protein, putative, expressed"
"LOC_Os03g58540",0.00659561589251,"TSV3","None","spo0B-associated GTP-binding protein, putative, expressed"
"LOC_Os05g32390",0.0065889343751,"--","None","FZL, putative, expressed"
"LOC_Os02g15660",0.0064989323118,"--","None","tetratricopeptide repeat, putative, expressed"
"LOC_Os09g36130",0.00649071457402,"--","None","expressed protein"
"LOC_Os04g23890",0.00643534281629,"OsNPH1b","None","AGC_PVPK_like_kin82y.10 - ACG kinases include homologs to PKA, PKG and PKC, expressed"
"LOC_Os04g38640",0.00641842616423,"--","None","OsDegp5 - Putative Deg protease homologue, expressed"
"LOC_Os05g35540",0.00639955513341,"--","None","GTPase of unknown function domain containing protein, putative, expressed"
"LOC_Os07g07310",0.00638831997232,"--","None","polynucleotide phosphorylase, putative, expressed"
"LOC_Os02g56040",0.00634996003829,"--","None","chaperone protein dnaJ, putative, expressed"
"LOC_Os01g03020",0.00633830866487,"--","None","tRNA synthetase class I, putative, expressed"
"LOC_Os10g39930",0.00626099415289,"--","None","cytochrome P450 97B2, putative, expressed"
"LOC_Os01g04900",0.00617643304862,"--","None","peptidase M50 family protein, putative, expressed"
"LOC_Os05g14270",0.00613189280045,"--","None","expressed protein"
"LOC_Os01g37870",0.00611656075462,"WSL","None","PPR repeat domain containing protein, putative, expressed"
"LOC_Os07g38300",0.00610661725827,"--","None","ribosome recycling factor, putative, expressed"
"LOC_Os01g62440",0.00597213872418,"--","None","ribonuclease protein, putative, expressed"
"LOC_Os12g19530",0.00596140440667,"--","None","ATP-binding region, ATPase-like domain-containing protein, putative, expressed"
"LOC_Os05g07130",0.00594437193417,"--","None","6PF-2-K/Fru-2,6-P2ASE liver isozyme, putative, expressed"
"LOC_Os11g05552",0.00585918667185,"YGL138(t)","None","signal recognition particle 54 kDa protein, chloroplast precursor, putative, expressed"
"LOC_Os02g22100",0.00583761489642,"--","None","OsRhmbd6 - Putative Rhomboid homologue, expressed"
"LOC_Os10g36530",0.00571768011005,"--","None","mutS domain V family protein, expressed"
"LOC_Os09g24530",0.00571550217085,"--","None","ribulose-1,5 bisphosphate carboxylase/oxygenase large subunit N-methyltransferase, chloroplast precursor, putative, expressed"
"LOC_Os01g31110",0.00570918241361,"OsCAF1","None","CRS2-associated factor 1, chloroplast precursor, putative, expressed"
"LOC_Os03g19760",0.0057057802993,"--","None","HAD-superfamily hydrolase, subfamily IA, variant 3 containing protein, expressed"
"LOC_Os08g29370",0.00570354683945,"--","None","peptidyl-prolyl cis-trans isomerase, chloroplast precursor, putative, expressed"
"LOC_Os04g50110",0.0056974379583,"--","None","RNA recognition motif containing protein, putative, expressed"
"LOC_Os08g32630",0.00569465102468,"--","None","FAD dependent oxidoreductase, putative, expressed"
"LOC_Os06g01400",0.00569385098717,"RA1","None","glycyl-tRNA synthetase 2, chloroplast/mitochondrial precursor, putative, expressed"
"LOC_Os03g10180",0.00565315407803,"--","None","expressed protein"
"LOC_Os01g52170",0.00564424468208,"--","None","expressed protein"
"LOC_Os02g49326",0.00560389259301,"--","None","SET domain-containing protein, putative, expressed"
"LOC_Os06g36840",0.00559756173769,"--","None","cysteine synthase, putative, expressed"
"LOC_Os09g39680",0.00555343944234,"--","None","transporter, major facilitator family, putative, expressed"
"LOC_Os02g17970",0.00551817777979,"OsPKG","None","AGC_PKA/PKG_like.1 - ACG kinases include homologs to PKA, PKG and PKC, expressed"
"LOC_Os04g34460",0.00551133021593,"OsFBN5","None","PAP fibrillin family domain containing protein, expressed"
"LOC_Os02g55120",0.00550285167422,"--","None","translation initiation factor IF-3, putative, expressed"
"LOC_Os08g34220",0.0054998402021,"OsFAD6","None","omega-6 fatty acid desaturase, chloroplast precursor, putative, expressed"
"LOC_Os08g25900",0.0053970533481,"--","None","PsbP, putative, expressed"
"LOC_Os02g47120",0.00539696815401,"--","None","region found in RelA/SpoT proteins containing protein, expressed"
"LOC_Os04g33210",0.00531904191495,"--","None","ERD1 protein, chloroplast precursor, putative, expressed"
"LOC_Os01g67720",0.00531892473491,"--","None","ABC1 family domain containing protein, putative, expressed"
"LOC_Os03g06740",0.00528621204653,"OsGR1","None","glutathione reductase, putative, expressed"
"LOC_Os09g33470",0.00528337093766,"--","None","mitochondrial carrier protein, putative, expressed"
"LOC_Os11g38030",0.00526647050994,"--","None","CDK5RAP1, putative, expressed"
"LOC_Os02g43350",0.00524824955008,"--","None","OsFtsH7  FtsH protease, homologue of AtFtsH7, expressed"
"LOC_Os02g31070",0.00524577797201,"--","None","expressed protein"
"LOC_Os03g21900",0.00524557162549,"--","None","uroporphyrinogen decarboxylase, putative, expressed"
"LOC_Os11g29230",0.00524494680755,"--","None","pentatricopeptide repeat protein PPR986-12, putative, expressed"
"LOC_Os06g02120",0.00519693127724,"--","None","PPR repeat domain containing protein, putative, expressed"
"LOC_Os02g41470",0.00519585533815,"--","None","tRNA synthetases class II domain containing protein, expressed"
"LOC_Os08g44810",0.00517717078968,"--","None","lactate/malate dehydrogenase, putative, expressed"
"LOC_Os05g33290",0.00517684347232,"--","None","uncharacterized conserved membrane protein specific to cyanobacteria, putative, expressed"
"LOC_Os04g46010",0.005160371159,"--","None","PPR repeat domain containing protein, putative, expressed"
"LOC_Os01g72980",0.00513555420679,"--","None","tRNA uridine 5-carboxymethylaminomethyl modification enzyme gidA, putative, expressed"
"LOC_Os06g51290",0.00509901144847,"PSY1","None","phytoene synthase, chloroplast precursor, putative, expressed"
"LOC_Os03g62510",0.00508719612311,"--","None","amine oxidase, flavin-containing, domain containing protein, expressed"
"LOC_Os10g35940",0.00507383436482,"--","None","folylpolyglutamate synthetase, putative, expressed"
"LOC_Os03g22160",0.00506780102254,"--","None","relA-SpoT like protein RSH1, putative, expressed"
"LOC_Os02g57120",0.00504383514162,"--","None","HEAT repeat family protein, putative, expressed"
"LOC_Os03g02690",0.00504326513309,"--","None","dihydrodipicolinate reductase, putative, expressed"
"LOC_Os02g33010",0.00501979584737,"--","None","expressed protein"
"LOC_Os03g31150",0.00497529363564,"OsAL1","None","expressed protein"
"LOC_Os01g01302",0.00494682529164,"OsSK4|OsSKL1","None","shikimate kinase, putative, expressed"
"LOC_Os04g47020",0.00494450322118,"--","None","genetic modifier, putative, expressed"
"LOC_Os03g24860",0.00490972094688,"--","None","transporter family protein, putative, expressed"
"LOC_Os09g36240",0.00490628813664,"--","None","deoxyribodipyrimidine photolyase family protein, expressed"
"LOC_Os11g01439",0.00489218290209,"--","None","chloroplast unusual positioning protein, putative, expressed"
"LOC_Os01g47450",0.00487653869003,"--","None","OsCttP1 - Putative C-terminal processing peptidase homologue, expressed"
